{
  "schema_version": "ide-handoff/v1",
  "handoff_id": "handoff_00000000000000000000000000000000",
  "created_at": "2026-08-14T00:00:00Z",
  "plan_refs": [
    {
      "plan_id": "plan_11111111111111111111111111111111",
      "record_digest": "1111111111111111111111111111111111111111111111111111111111111111"
    }
  ],
  "run_refs": [
    {
      "run_id": "run_22222222222222222222222222222222",
      "record_digest": "2222222222222222222222222222222222222222222222222222222222222222"
    }
  ],
  "artifact_refs": [
    {
      "artifact_id": "artifact_33333333333333333333333333333333",
      "record_digest": "3333333333333333333333333333333333333333333333333333333333333333"
    }
  ],
  "native_namespaces": [
    {
      "run_id": "run_22222222222222222222222222222222",
      "namespaces": ["phaseledger"]
    }
  ],
  "native_authority_availability": [
    {
      "run_id": "run_22222222222222222222222222222222",
      "availability": "not_reported"
    }
  ],
  "authority_effect": "none"
}
